{
  "schema": "iy.map_overview_metadata/v1",
  "map_id": "de_anubis",
  "asset": {
    "status": "NOT_INCLUDED",
    "reference": null,
    "upstream_material_identifier": "overviews/de_anubis",
    "reason": "No Valve overview image is redistributed by this repository; only source observations and unresolved projection metadata are included."
  },
  "canvas": {
    "width": 1024,
    "height": 1024,
    "unit": "overview_pixel",
    "origin": "top_left",
    "x_direction": "right",
    "y_direction": "down"
  },
  "transform": {
    "verification_status": "UNVERIFIED",
    "input_coordinate_space": "cs2_world_xy",
    "origin_world": {
      "x": null,
      "y": null,
      "convention": "upper_left_world_coordinate"
    },
    "world_units_per_pixel": null,
    "world_x_to_canvas": "UNRESOLVED",
    "world_y_to_canvas": "UNRESOLVED",
    "rotation_deg_clockwise": null,
    "rounding": "none_float",
    "clipping": "classify_only_no_clamp",
    "bounds_inclusive": true
  },
  "layers": {
    "status": "UNRESOLVED",
    "selection_axis": "UNRESOLVED",
    "items": [],
    "reason": "No verified vertical-section thresholds are included; no world-Z layer rule is inferred."
  },
  "reference_points": [],
  "provenance": {
    "retrieved_utc": "2026-08-27T00:00:00Z",
    "sources": [
      {
        "role": "projection_values_observed_but_not_activated",
        "repository": "SteamDatabase/GameTracking-CS2",
        "commit": "8651ef311b783fee253fc15c30966e4a15a3cacb",
        "path": "game/csgo/pak01_dir/resource/overviews/de_anubis.txt",
        "values_observed": {"pos_x": -2796, "pos_y": 3328, "scale": 5.22, "rotate": null},
        "authority_note": "The tracked shipped descriptor omits an explicit rotate field, so the V1 transform remains unverified and inactive."
      },
      {
        "role": "formula_and_canvas_cross_check",
        "repository": "pnxenopoulos/awpy",
        "commit": "007b119a6a5b4b8ee7d3011d96ce00bed7323c12",
        "paths": ["awpy/plot/utils.py", "awpy/plot/plot.py"],
        "authority_note": "Open-source Awpy plotting implementation cross-checks the general axis/scale convention but does not independently prove the missing map rotation value."
      }
    ],
    "distribution_note": "No overview texture, executable content, demo content, or game asset is included."
  },
  "verification": {
    "status": "PARTIAL",
    "verified_fields": [
      "canvas.width",
      "canvas.height",
      "asset.status",
      "provenance.sources"
    ],
    "unresolved_fields": [
      "transform.origin_world",
      "transform.world_units_per_pixel",
      "transform.world_x_to_canvas",
      "transform.world_y_to_canvas",
      "transform.rotation_deg_clockwise",
      "reference_points",
      "layers.selection_axis",
      "layers.items",
      "named_landmark_world_coordinates"
    ]
  }
}
